title,name,hindex,ranking,year,id,link,deadline,abstract_deadline,timezone,start,end,date,place,sub,note
WSC,Winter Simulation Conference,,B,2023,wsc23,https://meetings.informs.org/wordpress/wsc2023/,04.08.2023 06:59,,Europe/Berlin,12.10.2023,12/13/2023,December, 10-13, 2023,San Antonio,SIM,
SMMSO,Stochastic models for manufacturing and service operations,,,2022,smmso22,http://smmso.org/,3/15/2022 22:59,05.02.2022 23:59,Europe/Berlin,6/27/2022,07.01.2022,June, 27 - July, 1,Grenoble, France,ST,
APMS,Advances in Production Management Systems,,,2023,apms23,https://www.apms-conference.org,2/28/2023 21:59,,Europe/Berlin,09/17/2023,09/21/2023,September, 17 - 21,Trondheim, Norway,ST,
ISL,International Symposium on Logistics,,,2023,isl23,https://isl21.org,2/13/2023 23:59,2/13/2023 23:59,Europe/Berlin,07.09.2023,07.12.2023,July 9 - 12,Enschede, Netherlands,OR,
OR,International Conference on Operations Research,,B,2023,or23,https://www.or2023.uni-hamburg.de/en.html,4/30/2023 23:59,4/30/2023 23:59,Europe/Berlin,8/28/2023,09.01.2023,,August 29 - September 1,Hamburg, Germany,OR,
EURO,European Conference on Operational Research,,B,2022,euro22,https://euro2022espoo.com/,3/25/2022 22:59,3/25/2022,Europe/Berlin,07.03.2022,07.06.2022,July 3 - 6,Espoo, Finland,OR,
GOR,Gesellschaft für Operations Research,,,2023,gor23,https://www.gor-ev.de/gor-ag-operations-research-in-ingenieurwissenschafften,2/16/2023 23:59,,Europe/Berlin,3/15/2023,3/16/2023,March, 15 - 16,Cottbus, Germany,OR,
StochMod,Stochastic Modelling Meeting,,,2022,stochmod22,https://www.stochmod.eu/News/,,,Europe/Berlin,TBA,TBA,Date to be announced,,ST,Next meeting to be announced
IMHRC,International Material Handling Research Colloquium,,,2023,imhrc23,https://www.mhi.org/cicmhe/colloquium,01/15/2023 23:59,,Europe/Berlin,06/19/2023,06/23/2023,Dresden, Germany,,OR,Next meeting to be announced
WGTL,Wissenschaftliche Gesellschaft für Technische Logistik,,,2023,wgtl23,http://www.wgtl.de/sites_de/02_veranstaltungen.html,,,Europe/Berlin,09/26/2023,09/27/2023,September, 26 - 27,TU Dortmund,TL,
INFORMS,INFORMS Annual Meeting,,,2023,informs23,https://meetings.informs.org/wordpress/phoenix2023/,,,Arizona,10/15/2023,10/18/2023,October 15 - 18,Phoenix Convention Center, Hyatt Regency Phoenix, AZ, USA,OR,
